GEO.id,GEO.id2,GEO.display-label,HC01_VC20,HC01_VC134
Id,Id2,Geography,Estimate; HOUSEHOLDS BY TYPE - Average household size,Estimate; PLACE OF BIRTH - Foreign born
310M100US10140,10140,"Aberdeen, WA Micro Area",2.72,4754
310M100US10180,10180,"Abilene, TX Metro Area",2.55,8631
310M100US10300,10300,"Adrian, MI Micro Area",2.46,2526
310M100US10420,10420,"Akron, OH Metro Area",2.49,26902
310M100US10460,10460,"Alamogordo, NM Micro Area",2.5,8463
310M100US10500,10500,"Albany, GA Metro Area",2.69,2706
310M100US10540,10540,"Albany-Lebanon, OR Micro Area",2.57,5833
310M100US10580,10580,"Albany-Schenectady-Troy, NY Metro Area",2.42,54708
310M100US10700,10700,"Albertville, AL Micro Area",2.76,7232
310M100US10740,10740,"Albuquerque, NM Metro Area",2.57,86199
310M100US10780,10780,"Alexandria, LA Metro Area",2.83,4343
310M100US10880,10880,"Allegan, MI Micro Area",2.69,5212
310M100US10900,10900,"Allentown-Bethlehem-Easton, PA-NJ Metro Area",2.57,67327
310M100US11020,11020,"Altoona, PA Metro Area",2.43,1484
310M100US11100,11100,"Amarillo, TX Metro Area",2.6,20623
310M100US11180,11180,"Ames, IA Metro Area",2.35,6738
310M100US11260,11260,"Anchorage, AK Metro Area",2.7,31638
310M100US11300,11300,"Anderson, IN Metro Area",2.5,2310
310M100US11340,11340,"Anderson, SC Metro Area",2.57,3911
310M100US11460,11460,"Ann Arbor, MI Metro Area",2.46,41722
310M100US11500,11500,"Anniston-Oxford, AL Metro Area",2.58,2309
310M100US11540,11540,"Appleton, WI Metro Area",2.58,9170
310M100US11700,11700,"Asheville, NC Metro Area",2.32,22718
310M100US11780,11780,"Ashtabula, OH Micro Area",2.49,1221
310M100US11980,11980,"Athens, TX Micro Area",2.63,4564
310M100US12020,12020,"Athens-Clarke County, GA Metro Area",2.77,14595
310M100US12060,12060,"Atlanta-Sandy Springs-Marietta, GA Metro Area",2.78,711185
310M100US12100,12100,"Atlantic City-Hammonton, NJ Metro Area",2.67,45944
310M100US12180,12180,"Auburn, NY Micro Area",2.41,1836
310M100US12220,12220,"Auburn-Opelika, AL Metro Area",2.46,7416
310M100US12260,12260,"Augusta-Richmond County, GA-SC Metro Area",2.63,23454
310M100US12300,12300,"Augusta-Waterville, ME Micro Area",2.29,2532
310M100US12420,12420,"Austin-Round Rock-San Marcos, TX Metro Area",2.63,266528
310M100US12540,12540,"Bakersfield-Delano, CA Metro Area",3.22,173413
310M100US12580,12580,"Baltimore-Towson, MD Metro Area",2.6,245777
310M100US12620,12620,"Bangor, ME Metro Area",2.36,2987
310M100US12700,12700,"Barnstable Town, MA Metro Area",2.24,15586
310M100US12940,12940,"Baton Rouge, LA Metro Area",2.66,29866
310M100US12980,12980,"Battle Creek, MI Metro Area",2.55,3933
310M100US13020,13020,"Bay City, MI Metro Area",2.45,1309
310M100US13140,13140,"Beaumont-Port Arthur, TX Metro Area",2.59,29851
310M100US13180,13180,"Beaver Dam, WI Micro Area",2.56,2392
310M100US13220,13220,"Beckley, WV Micro Area",2.35,1979
310M100US13380,13380,"Bellingham, WA Metro Area",2.48,27703
310M100US13460,13460,"Bend, OR Metro Area",2.46,8031
310M100US13740,13740,"Billings, MT Metro Area",2.44,2579
310M100US13780,13780,"Binghamton, NY Metro Area",2.39,12312
310M100US13820,13820,"Birmingham-Hoover, AL Metro Area",2.56,48047
310M100US13900,13900,"Bismarck, ND Metro Area",2.35,674
310M100US13980,13980,"Blacksburg-Christiansburg-Radford, VA Metro Area",2.41,10231
310M100US14020,14020,"Bloomington, IN Metro Area",2.39,11787
310M100US14060,14060,"Bloomington-Normal, IL Metro Area",2.57,11350
310M100US14100,14100,"Bloomsburg-Berwick, PA Micro Area",2.48,1919
310M100US14140,14140,"Bluefield, WV-VA Micro Area",2.35,831
310M100US14260,14260,"Boise City-Nampa, ID Metro Area",2.71,46156
310M100US14460,14460,"Boston-Cambridge-Quincy, MA-NH Metro Area",2.52,770995
310M100US14500,14500,"Boulder, CO Metro Area",2.45,32853
310M100US14540,14540,"Bowling Green, KY Metro Area",2.51,9864
310M100US14580,14580,"Bozeman, MT Micro Area",2.35,2256
310M100US14660,14660,"Brainerd, MN Micro Area",2.37,1297
310M100US14700,14700,"Branson, MO Micro Area",2.42,2721
310M100US14740,14740,"Bremerton-Silverdale, WA Metro Area",2.42,18032
310M100US14860,14860,"Bridgeport-Stamford-Norwalk, CT Metro Area",2.74,180728
310M100US15180,15180,"Brownsville-Harlingen, TX Metro Area",3.46,100365
310M100US15260,15260,"Brunswick, GA Metro Area",2.55,4719
310M100US15380,15380,"Buffalo-Niagara Falls, NY Metro Area",2.36,66786
310M100US15500,15500,"Burlington, NC Metro Area",2.44,8872
310M100US15540,15540,"Burlington-South Burlington, VT Metro Area",2.41,12240
310M100US15940,15940,"Canton-Massillon, OH Metro Area",2.48,6898
310M100US15980,15980,"Cape Coral-Fort Myers, FL Metro Area",2.61,92109
310M100US16020,16020,"Cape Girardeau-Jackson, MO-IL Metro Area",2.54,2097
310M100US16180,16180,"Carson City, NV Metro Area",2.52,6816
310M100US16220,16220,"Casper, WY Metro Area",2.49,1400
310M100US16300,16300,"Cedar Rapids, IA Metro Area",2.42,5792
310M100US16500,16500,"Centralia, WA Micro Area",2.51,3705
310M100US16540,16540,"Chambersburg, PA Micro Area",2.6,5733
310M100US16580,16580,"Champaign-Urbana, IL Metro Area",2.35,25144
310M100US16620,16620,"Charleston, WV Metro Area",2.43,4116
310M100US16660,16660,"Charleston-Mattoon, IL Micro Area",2.41,1428
310M100US16700,16700,"Charleston-North Charleston-Summerville, SC Metro Area",2.57,35920
310M100US16740,16740,"Charlotte-Gastonia-Rock Hill, NC-SC Metro Area",2.63,184314
310M100US16820,16820,"Charlottesville, VA Metro Area",2.46,16803
310M100US16860,16860,"Chattanooga, TN-GA Metro Area",2.5,20664
310M100US16940,16940,"Cheyenne, WY Metro Area",2.42,2794
310M100US16980,16980,"Chicago-Joliet-Naperville, IL-IN-WI Metro Area",2.75,1689862
310M100US17020,17020,"Chico, CA Metro Area",2.57,17261
310M100US17060,17060,"Chillicothe, OH Micro Area",2.51,553
310M100US17140,17140,"Cincinnati-Middletown, OH-KY-IN Metro Area",2.6,87518
310M100US17220,17220,"Clarksburg, WV Micro Area",2.52,451
310M100US17300,17300,"Clarksville, TN-KY Metro Area",2.68,16302
310M100US17340,17340,"Clearlake, CA Micro Area",2.19,5439
310M100US17420,17420,"Cleveland, TN Metro Area",2.62,4388
310M100US17460,17460,"Cleveland-Elyria-Mentor, OH Metro Area",2.4,124779
310M100US17660,17660,"Coeur d'Alene, ID Metro Area",2.49,2522
310M100US17780,17780,"College Station-Bryan, TX Metro Area",2.69,27151
310M100US17820,17820,"Colorado Springs, CO Metro Area",2.6,45273
310M100US17860,17860,"Columbia, MO Metro Area",2.48,9489
310M100US17900,17900,"Columbia, SC Metro Area",2.51,38510
310M100US17940,17940,"Columbia, TN Micro Area",2.57,2263
310M100US17980,17980,"Columbus, GA-AL Metro Area",2.59,12429
310M100US18020,18020,"Columbus, IN Metro Area",2.64,4624
310M100US18140,18140,"Columbus, OH Metro Area",2.53,126297
310M100US18180,18180,"Concord, NH Micro Area",2.43,5328
310M100US18260,18260,"Cookeville, TN Micro Area",2.45,2799
310M100US18300,18300,"Coos Bay, OR Micro Area",2.28,1572
310M100US18500,18500,"Corning, NY Micro Area",2.33,3295
310M100US18580,18580,"Corpus Christi, TX Metro Area",2.77,32188
310M100US18700,18700,"Corvallis, OR Metro Area",2.46,8767
310M100US18880,18880,"Crestview-Fort Walton Beach-Destin, FL Metro Area",2.53,12666
310M100US18980,18980,"Cullman, AL Micro Area",2.49,1623
310M100US19060,19060,"Cumberland, MD-WV Metro Area",2.39,1056
310M100US19100,19100,"Dallas-Fort Worth-Arlington, TX Metro Area",2.8,1142893
310M100US19140,19140,"Dalton, GA Metro Area",2.95,20107
310M100US19180,19180,"Danville, IL Metro Area",2.53,1403
310M100US19260,19260,"Danville, VA Metro Area",2.38,2125
310M100US19300,19300,"Daphne-Fairhope-Foley, AL Micro Area",2.48,6982
310M100US19340,19340,"Davenport-Moline-Rock Island, IA-IL Metro Area",2.41,16767
310M100US19380,19380,"Dayton, OH Metro Area",2.36,30375
310M100US19460,19460,"Decatur, AL Metro Area",2.59,7681
310M100US19500,19500,"Decatur, IL Metro Area",2.46,1689
310M100US19660,19660,"Deltona-Daytona Beach-Ormond Beach, FL Metro Area",2.55,36269
310M100US19740,19740,"Denver-Aurora-Broomfield, CO Metro Area",2.55,314716
310M100US19780,19780,"Des Moines-West Des Moines, IA Metro Area",2.54,44531
310M100US19820,19820,"Detroit-Warren-Livonia, MI Metro Area",2.59,372801
310M100US20020,20020,"Dothan, AL Metro Area",2.53,2793
310M100US20100,20100,"Dover, DE Metro Area",2.82,7287
310M100US20180,20180,"DuBois, PA Micro Area",2.33,1877
310M100US20220,20220,"Dubuque, IA Metro Area",2.39,2743
310M100US20260,20260,"Duluth, MN-WI Metro Area",2.3,7061
310M100US20380,20380,"Dunn, NC Micro Area",2.78,6223
310M100US20500,20500,"Durham-Chapel Hill, NC Metro Area",2.4,63859
310M100US20620,20620,"East Liverpool-Salem, OH Micro Area",2.45,792
310M100US20700,20700,"East Stroudsburg, PA Micro Area",2.9,19456
310M100US20740,20740,"Eau Claire, WI Metro Area",2.41,3430
310M100US20940,20940,"El Centro, CA Metro Area",3.39,58298
310M100US21060,21060,"Elizabethtown, KY Metro Area",2.68,4711
310M100US21140,21140,"Elkhart-Goshen, IN Metro Area",2.76,17666
310M100US21300,21300,"Elmira, NY Metro Area",2.26,3067
310M100US21340,21340,"El Paso, TX Metro Area",3.14,213274
310M100US21460,21460,"Enterprise-Ozark, AL Micro Area",2.64,5063
310M100US21500,21500,"Erie, PA Metro Area",2.46,11022
310M100US21660,21660,"Eugene-Springfield, OR Metro Area",2.37,20282
310M100US21700,21700,"Eureka-Arcata-Fortuna, CA Micro Area",2.55,7657
310M100US21780,21780,"Evansville, IN-KY Metro Area",2.44,7850
310M100US21820,21820,"Fairbanks, AK Metro Area",2.58,5708
310M100US22020,22020,"Fargo, ND-MN Metro Area",2.31,10381
310M100US22100,22100,"Farmington, MO Micro Area",2.17,675
310M100US22140,22140,"Farmington, NM Metro Area",2.99,5485
310M100US22180,22180,"Fayetteville, NC Metro Area",2.67,20182
310M100US22220,22220,"Fayetteville-Springdale-Rogers, AR-MO Metro Area",2.62,54832
310M100US22300,22300,"Findlay, OH Micro Area",2.46,2043
310M100US22380,22380,"Flagstaff, AZ Metro Area",2.8,7963
310M100US22420,22420,"Flint, MI Metro Area",2.55,8763
310M100US22500,22500,"Florence, SC Metro Area",2.61,4572
310M100US22520,22520,"Florence-Muscle Shoals, AL Metro Area",2.35,2896
310M100US22540,22540,"Fond du Lac, WI Metro Area",2.39,3024
310M100US22580,22580,"Forest City, NC Micro Area",2.46,1492
310M100US22660,22660,"Fort Collins-Loveland, CO Metro Area",2.44,17374
310M100US22840,22840,"Fort Payne, AL Micro Area",2.6,5130
310M100US22900,22900,"Fort Smith, AR-OK Metro Area",2.63,16685
310M100US23060,23060,"Fort Wayne, IN Metro Area",2.56,23312
310M100US23180,23180,"Frankfort, KY Micro Area",2.38,763
310M100US23420,23420,"Fresno, CA Metro Area",3.23,213117
310M100US23460,23460,"Gadsden, AL Metro Area",2.54,2311
310M100US23540,23540,"Gainesville, FL Metro Area",2.45,29338
310M100US23580,23580,"Gainesville, GA Metro Area",3.01,26117
310M100US23660,23660,"Galesburg, IL Micro Area",2.32,1859
310M100US23700,23700,"Gallup, NM Micro Area",4.31,2023
310M100US23900,23900,"Gettysburg, PA Micro Area",2.55,4159
310M100US24020,24020,"Glens Falls, NY Metro Area",2.4,3325
310M100US24140,24140,"Goldsboro, NC Metro Area",2.48,8394
310M100US24220,24220,"Grand Forks, ND-MN Metro Area",2.36,2482
310M100US24260,24260,"Grand Island, NE Micro Area",2.58,6420
310M100US24300,24300,"Grand Junction, CO Metro Area",2.4,5935
310M100US24340,24340,"Grand Rapids-Wyoming, MI Metro Area",2.61,49149
310M100US24420,24420,"Grants Pass, OR Micro Area",2.37,2649
310M100US24500,24500,"Great Falls, MT Metro Area",2.46,1894
310M100US24540,24540,"Greeley, CO Metro Area",2.79,17988
310M100US24580,24580,"Green Bay, WI Metro Area",2.47,13761
310M100US24620,24620,"Greeneville, TN Micro Area",2.34,1862
310M100US24660,24660,"Greensboro-High Point, NC Metro Area",2.45,56317
310M100US24780,24780,"Greenville, NC Metro Area",2.63,10291
310M100US24860,24860,"Greenville-Mauldin-Easley, SC Metro Area",2.59,41787
310M100US24940,24940,"Greenwood, SC Micro Area",2.45,1757
310M100US25060,25060,"Gulfport-Biloxi, MS Metro Area",2.53,9503
310M100US25180,25180,"Hagerstown-Martinsburg, MD-WV Metro Area",2.51,11507
310M100US25220,25220,"Hammond, LA Micro Area",2.67,2576
310M100US25260,25260,"Hanford-Corcoran, CA Metro Area",3.25,30316
310M100US25420,25420,"Harrisburg-Carlisle, PA Metro Area",2.41,29541
310M100US25500,25500,"Harrisonburg, VA Metro Area",2.67,11161
310M100US25540,25540,"Hartford-West Hartford-East Hartford, CT Metro Area",2.5,158221
310M100US25620,25620,"Hattiesburg, MS Metro Area",2.62,4595
310M100US25740,25740,"Helena, MT Micro Area",2.32,1242
310M100US25860,25860,"Hickory-Lenoir-Morganton, NC Metro Area",2.63,19611
310M100US25900,25900,"Hilo, HI Micro Area",2.84,21868
310M100US25940,25940,"Hilton Head Island-Beaufort, SC Micro Area",2.55,21141
310M100US25980,25980,"Hinesville-Fort Stewart, GA Metro Area",2.64,4720
310M100US26020,26020,"Hobbs, NM Micro Area",3.04,10485
310M100US26100,26100,"Holland-Grand Haven, MI Metro Area",2.73,16190
310M100US26140,26140,"Homosassa Springs, FL Micro Area",2.26,4934
310M100US26180,26180,"Honolulu, HI Metro Area",3.01,186264
310M100US26300,26300,"Hot Springs, AR Metro Area",2.5,1827
310M100US26380,26380,"Houma-Bayou Cane-Thibodaux, LA Metro Area",2.72,6928
310M100US26420,26420,"Houston-Sugar Land-Baytown, TX Metro Area",2.91,1335284
310M100US26580,26580,"Huntington-Ashland, WV-KY-OH Metro Area",2.48,3500
310M100US26620,26620,"Huntsville, AL Metro Area",2.48,18886
310M100US26660,26660,"Huntsville, TX Micro Area",2.33,4518
310M100US26740,26740,"Hutchinson, KS Micro Area",2.36,1724
310M100US26820,26820,"Idaho Falls, ID Metro Area",2.94,5605
310M100US26860,26860,"Indiana, PA Micro Area",2.4,1779
310M100US26900,26900,"Indianapolis-Carmel, IN Metro Area",2.58,111052
310M100US26980,26980,"Iowa City, IA Metro Area",2.32,13394
310M100US27060,27060,"Ithaca, NY Metro Area",2.27,13833
310M100US27100,27100,"Jackson, MI Metro Area",2.56,2981
310M100US27140,27140,"Jackson, MS Metro Area",2.67,12596
310M100US27180,27180,"Jackson, TN Metro Area",2.71,3731
310M100US27260,27260,"Jacksonville, FL Metro Area",2.62,106318
310M100US27340,27340,"Jacksonville, NC Metro Area",2.73,7743
310M100US27460,27460,"Jamestown-Dunkirk-Fredonia, NY Micro Area",2.28,2690
310M100US27500,27500,"Janesville, WI Metro Area",2.46,7740
310M100US27620,27620,"Jefferson City, MO Metro Area",2.49,4206
310M100US27740,27740,"Johnson City, TN Metro Area",2.3,6302
310M100US27780,27780,"Johnstown, PA Metro Area",2.36,2138
310M100US27860,27860,"Jonesboro, AR Metro Area",2.5,2404
310M100US27900,27900,"Joplin, MO Metro Area",2.6,7227
310M100US27980,27980,"Kahului-Wailuku, HI Micro Area",2.93,25288
310M100US28020,28020,"Kalamazoo-Portage, MI Metro Area",2.54,16671
310M100US28060,28060,"Kalispell, MT Micro Area",2.4,2115
310M100US28100,28100,"Kankakee-Bradley, IL Metro Area",2.64,5365
310M100US28140,28140,"Kansas City, MO-KS Metro Area",2.54,136513
310M100US28180,28180,"Kapaa, HI Micro Area",2.92,12637
310M100US28300,28300,"Keene, NH Micro Area",2.36,2376
310M100US28420,28420,"Kennewick-Pasco-Richland, WA Metro Area",2.93,41091
310M100US28580,28580,"Key West, FL Micro Area",2.91,14310
310M100US28660,28660,"Killeen-Temple-Fort Hood, TX Metro Area",3.05,31501
310M100US28700,28700,"Kingsport-Bristol-Bristol, TN-VA Metro Area",2.35,4799
310M100US28740,28740,"Kingston, NY Metro Area",2.46,12465
310M100US28900,28900,"Klamath Falls, OR Micro Area",2.44,2966
310M100US28940,28940,"Knoxville, TN Metro Area",2.39,29145
310M100US29020,29020,"Kokomo, IN Metro Area",2.4,2127
310M100US29100,29100,"La Crosse, WI-MN Metro Area",2.41,4505
310M100US29140,29140,"Lafayette, IN Metro Area",2.48,20048
310M100US29180,29180,"Lafayette, LA Metro Area",2.59,10826
310M100US29300,29300,"LaGrange, GA Micro Area",2.68,3815
310M100US29340,29340,"Lake Charles, LA Metro Area",2.63,3416
310M100US29380,29380,"Lake City, FL Micro Area",2.64,3814
310M100US29420,29420,"Lake Havasu City-Kingman, AZ Metro Area",2.5,12506
310M100US29460,29460,"Lakeland-Winter Haven, FL Metro Area",2.73,65299
310M100US29540,29540,"Lancaster, PA Metro Area",2.64,21162
310M100US29580,29580,"Lancaster, SC Micro Area",2.54,1959
310M100US29620,29620,"Lansing-East Lansing, MI Metro Area",2.48,30426
310M100US29700,29700,"Laredo, TX Metro Area",3.74,71492
310M100US29740,29740,"Las Cruces, NM Metro Area",2.78,36961
310M100US29820,29820,"Las Vegas-Paradise, NV Metro Area",2.8,428429
310M100US29860,29860,"Laurel, MS Micro Area",2.63,2865
310M100US29940,29940,"Lawrence, KS Metro Area",2.39,8398
310M100US30020,30020,"Lawton, OK Metro Area",2.59,7789
310M100US30100,30100,"Lebanon, NH-VT Micro Area",2.34,6796
310M100US30140,30140,"Lebanon, PA Metro Area",2.53,3598
310M100US30300,30300,"Lewiston, ID-WA Metro Area",2.43,659
310M100US30340,30340,"Lewiston-Auburn, ME Metro Area",2.34,2679
310M100US30460,30460,"Lexington-Fayette, KY Metro Area",2.44,30305
310M100US30500,30500,"Lexington Park, MD Micro Area",2.85,4264
310M100US30620,30620,"Lima, OH Metro Area",2.54,1821
310M100US30700,30700,"Lincoln, NE Metro Area",2.42,21898
310M100US30740,30740,"Lincolnton, NC Micro Area",2.72,2419
310M100US30780,30780,"Little Rock-North Little Rock-Conway, AR Metro Area",2.54,26363
310M100US30860,30860,"Logan, UT-ID Metro Area",3.12,8636
310M100US30980,30980,"Longview, TX Metro Area",2.7,19174
310M100US31020,31020,"Longview, WA Metro Area",2.49,4186
310M100US31100,31100,"Los Angeles-Long Beach-Santa Ana, CA Metro Area",3.03,4410027
310M100US31140,31140,"Louisville/Jefferson County, KY-IN Metro Area",2.55,62150
310M100US31180,31180,"Lubbock, TX Metro Area",2.62,19076
310M100US31260,31260,"Lufkin, TX Micro Area",2.76,7037
310M100US31300,31300,"Lumberton, NC Micro Area",2.99,7841
310M100US31340,31340,"Lynchburg, VA Metro Area",2.47,5306
310M100US31420,31420,"Macon, GA Metro Area",2.6,6928
310M100US31460,31460,"Madera-Chowchilla, CA Metro Area",3.47,33407
310M100US31540,31540,"Madison, WI Metro Area",2.36,40413
310M100US31700,31700,"Manchester-Nashua, NH Metro Area",2.57,35517
310M100US31740,31740,"Manhattan, KS Metro Area",2.62,7652
310M100US31820,31820,"Manitowoc, WI Micro Area",2.35,2251
310M100US31860,31860,"Mankato-North Mankato, MN Metro Area",2.44,2306
310M100US31900,31900,"Mansfield, OH Metro Area",2.4,1416
310M100US31940,31940,"Marinette, WI-MI Micro Area",2.3,757
310M100US31980,31980,"Marion, IN Micro Area",2.28,1080
310M100US32020,32020,"Marion, OH Micro Area",2.42,316
310M100US32060,32060,"Marion-Herrin, IL Micro Area",2.43,1147
310M100US32100,32100,"Marquette, MI Micro Area",2.38,462
310M100US32220,32220,"Marshall, TX Micro Area",2.68,3664
310M100US32270,32270,"Marshfield-Wisconsin Rapids, WI Micro Area",2.3,2026
310M100US32300,32300,"Martinsville, VA Micro Area",2.26,2024
310M100US32580,32580,"McAllen-Edinburg-Mission, TX Metro Area",3.66,244555
310M100US32740,32740,"Meadville, PA Micro Area",2.43,948
310M100US32780,32780,"Medford, OR Metro Area",2.38,10832
310M100US32820,32820,"Memphis, TN-MS-AR Metro Area",2.71,65975
310M100US32900,32900,"Merced, CA Metro Area",3.42,68607
310M100US32940,32940,"Meridian, MS Micro Area",2.63,1557
310M100US33100,33100,"Miami-Fort Lauderdale-Pompano Beach, FL Metro Area",2.78,2166385
310M100US33140,33140,"Michigan City-La Porte, IN Metro Area",2.44,4144
310M100US33220,33220,"Midland, MI Micro Area",2.45,3891
310M100US33260,33260,"Midland, TX Metro Area",2.73,14821
310M100US33340,33340,"Milwaukee-Waukesha-West Allis, WI Metro Area",2.49,110426
310M100US33460,33460,"Minneapolis-St. Paul-Bloomington, MN-WI Metro Area",2.54,322725
310M100US33500,33500,"Minot, ND Micro Area",2.52,1066
310M100US33540,33540,"Missoula, MT Metro Area",2.34,3498
310M100US33660,33660,"Mobile, AL Metro Area",2.56,14144
310M100US33700,33700,"Modesto, CA Metro Area",3.06,108778
310M100US33740,33740,"Monroe, LA Metro Area",2.55,3063
310M100US33780,33780,"Monroe, MI Metro Area",2.61,2809
310M100US33860,33860,"Montgomery, AL Metro Area",2.62,10015
310M100US33980,33980,"Morehead City, NC Micro Area",2.36,1688
310M100US34060,34060,"Morgantown, WV Metro Area",2.57,3353
310M100US34100,34100,"Morristown, TN Metro Area",2.53,5911
310M100US34180,34180,"Moses Lake, WA Micro Area",2.91,16246
310M100US34340,34340,"Mount Airy, NC Micro Area",2.36,3216
310M100US34380,34380,"Mount Pleasant, MI Micro Area",2.7,1655
310M100US34580,34580,"Mount Vernon-Anacortes, WA Metro Area",2.53,10576
310M100US34620,34620,"Muncie, IN Metro Area",2.41,2391
310M100US34740,34740,"Muskegon-Norton Shores, MI Metro Area",2.61,2433
310M100US34780,34780,"Muskogee, OK Micro Area",2.49,1342
310M100US34820,34820,"Myrtle Beach-North Myrtle Beach-Conway, SC Metro Area",2.5,17674
310M100US34860,34860,"Nacogdoches, TX Micro Area",2.59,5903
310M100US34900,34900,"Napa, CA Metro Area",2.66,33220
310M100US34940,34940,"Naples-Marco Island, FL Metro Area",2.62,77984
310M100US34980,34980,"Nashville-Davidson--Murfreesboro--Franklin, TN Metro Area",2.58,127776
310M100US35100,35100,"New Bern, NC Micro Area",2.56,5330
310M100US35260,35260,"New Castle, PA Micro Area",2.42,1338
310M100US35300,35300,"New Haven-Milford, CT Metro Area",2.55,99043
310M100US35340,35340,"New Iberia, LA Micro Area",2.71,2580
310M100US35380,35380,"New Orleans-Metairie-Kenner, LA Metro Area",2.56,84184
310M100US35420,35420,"New Philadelphia-Dover, OH Micro Area",2.45,943
310M100US35620,35620,"New York-Northern New Jersey-Long Island, NY-NJ-PA Metro Area",2.74,5513533
310M100US35660,35660,"Niles-Benton Harbor, MI Metro Area",2.69,8978
310M100US35840,35840,"North Port-Bradenton-Sarasota, FL Metro Area",2.27,91268
310M100US35900,35900,"North Wilkesboro, NC Micro Area",2.44,2318
310M100US35980,35980,"Norwich-New London, CT Metro Area",2.41,22375
310M100US36020,36020,"Oak Harbor, WA Micro Area",2.33,5527
310M100US36100,36100,"Ocala, FL Metro Area",2.43,28151
310M100US36140,36140,"Ocean City, NJ Metro Area",2.29,5091
310M100US36220,36220,"Odessa, TX Metro Area",2.77,18530
310M100US36260,36260,"Ogden-Clearfield, UT Metro Area",3.09,30918
310M100US36300,36300,"Ogdensburg-Massena, NY Micro Area",2.45,5412
310M100US36420,36420,"Oklahoma City, OK Metro Area",2.58,101990
310M100US36460,36460,"Olean, NY Micro Area",2.42,1162
310M100US36500,36500,"Olympia, WA Metro Area",2.48,19261
310M100US36540,36540,"Omaha-Council Bluffs, NE-IA Metro Area",2.56,59862
310M100US36660,36660,"Opelousas-Eunice, LA Micro Area",2.63,463
310M100US36700,36700,"Orangeburg, SC Micro Area",2.68,1355
310M100US36740,36740,"Orlando-Kissimmee-Sanford, FL Metro Area",2.78,356163
310M100US36780,36780,"Oshkosh-Neenah, WI Metro Area",2.33,5809
310M100US36860,36860,"Ottawa-Streator, IL Micro Area",2.5,5233
310M100US36980,36980,"Owensboro, KY Metro Area",2.69,1876
310M100US37020,37020,"Owosso, MI Micro Area",2.53,616
310M100US37100,37100,"Oxnard-Thousand Oaks-Ventura, CA Metro Area",3.09,182987
310M100US37140,37140,"Paducah, KY-IL Micro Area",2.47,1256
310M100US37260,37260,"Palatka, FL Micro Area",2.55,3005
310M100US37340,37340,"Palm Bay-Melbourne-Titusville, FL Metro Area",2.48,46599
310M100US37380,37380,"Palm Coast, FL Metro Area",2.81,14553
310M100US37460,37460,"Panama City-Lynn Haven-Panama City Beach, FL Metro Area",2.38,8405
310M100US37620,37620,"Parkersburg-Marietta-Vienna, WV-OH Metro Area",2.47,1426
310M100US37700,37700,"Pascagoula, MS Metro Area",2.68,7201
310M100US37820,37820,"Pendleton-Hermiston, OR Micro Area",2.73,7814
310M100US37860,37860,"Pensacola-Ferry Pass-Brent, FL Metro Area",2.6,25270
310M100US37900,37900,"Peoria, IL Metro Area",2.45,12978
310M100US37980,37980,"Philadelphia-Camden-Wilmington, PA-NJ-DE-MD Metro Area",2.62,586661
310M100US38060,38060,"Phoenix-Mesa-Glendale, AZ Metro Area",2.74,618486
310M100US38220,38220,"Pine Bluff, AR Metro Area",2.46,926
310M100US38300,38300,"Pittsburgh, PA Metro Area",2.34,76990
310M100US38340,38340,"Pittsfield, MA Metro Area",2.24,5769
310M100US38460,38460,"Plattsburgh, NY Micro Area",2.3,3898
310M100US38540,38540,"Pocatello, ID Metro Area",2.68,3365
310M100US38820,38820,"Port Angeles, WA Micro Area",2.25,3604
310M100US38860,38860,"Portland-South Portland-Biddeford, ME Metro Area",2.39,23491
310M100US38900,38900,"Portland-Vancouver-Hillsboro, OR-WA Metro Area",2.55,282184
310M100US38940,38940,"Port St. Lucie, FL Metro Area",2.57,50926
310M100US39020,39020,"Portsmouth, OH Micro Area",2.63,712
310M100US39060,39060,"Pottsville, PA Micro Area",2.34,2968
310M100US39100,39100,"Poughkeepsie-Newburgh-Middletown, NY Metro Area",2.76,81088
310M100US39140,39140,"Prescott, AZ Metro Area",2.29,13940
310M100US39300,39300,"Providence-New Bedford-Fall River, RI-MA Metro Area",2.48,209582
310M100US39340,39340,"Provo-Orem, UT Metro Area",3.62,42477
310M100US39380,39380,"Pueblo, CO Metro Area",2.5,5708
310M100US39460,39460,"Punta Gorda, FL Metro Area",2.31,18480
310M100US39500,39500,"Quincy, IL-MO Micro Area",2.53,940
310M100US39540,39540,"Racine, WI Metro Area",2.51,8667
310M100US39580,39580,"Raleigh-Cary, NC Metro Area",2.67,132913
310M100US39660,39660,"Rapid City, SD Metro Area",2.5,2243
310M100US39740,39740,"Reading, PA Metro Area",2.57,27399
310M100US39820,39820,"Redding, CA Metro Area",2.53,9861
310M100US39900,39900,"Reno-Sparks, NV Metro Area",2.6,62487
310M100US39980,39980,"Richmond, IN Micro Area",2.33,1373
310M100US40060,40060,"Richmond, VA Metro Area",2.6,90485
310M100US40080,40080,"Richmond-Berea, KY Micro Area",2.52,948
310M100US40140,40140,"Riverside-San Bernardino-Ontario, CA Metro Area",3.26,918012
310M100US40220,40220,"Roanoke, VA Metro Area",2.41,11936
310M100US40260,40260,"Roanoke Rapids, NC Micro Area",2.31,1833
310M100US40340,40340,"Rochester, MN Metro Area",2.51,13588
310M100US40380,40380,"Rochester, NY Metro Area",2.42,68726
310M100US40420,40420,"Rockford, IL Metro Area",2.66,29293
310M100US40580,40580,"Rocky Mount, NC Metro Area",2.59,4767
310M100US40660,40660,"Rome, GA Metro Area",2.64,6450
310M100US40700,40700,"Roseburg, OR Micro Area",2.44,3466
310M100US40740,40740,"Roswell, NM Micro Area",2.71,9922
310M100US40780,40780,"Russellville, AR Micro Area",2.57,4411
310M100US40900,40900,"Sacramento--Arden-Arcade--Roseville, CA Metro Area",2.73,390352
310M100US40980,40980,"Saginaw-Saginaw Township North, MI Metro Area",2.53,3840
310M100US41060,41060,"St. Cloud, MN Metro Area",2.5,6994
310M100US41100,41100,"St. George, UT Metro Area",3.03,7322
